{"id": "I01", "type": "ideation", "label": "GEOS XML authoring as eval target (36-task easy-setting suite)", "status": "Assumed", "grounding": "empirical", "parent": null, "date": "2026-04-20", "rationale": "Task set mined from GEOS tutorial RSTs; easy setting provides all values; ground truth XML available. Well-established by prior repo1/repo2/repo3 work.", "evidence": []}
{"id": "I02", "type": "ideation", "label": "XMLTreeSim as headline metric (0-1, reported as x10)", "status": "Assumed", "grounding": "literature+empirical", "parent": "I01", "date": "2026-04-20", "rationale": "Replaces arbitrary weighted composite; respects tree structure; handles element multiplicity via bipartite matching; per-section sub-scores fall out naturally. Implemented in src/eval/judge_geos.py.", "evidence": []}
{"id": "I03", "type": "ideation", "label": "Docker-per-task sandbox + hardlink contamination filter + RAG blocklist", "status": "Assumed", "grounding": "empirical", "parent": "I01", "date": "2026-04-20", "rationale": "Two-layer enforcement: filesystem-level hardlink tree bind-mounted ro + MCP-server-level excluded-source filter. Variant stem expansion + example_pairs.jsonl RST mapping. Audited via eval_metadata.json per task.", "evidence": []}
{"id": "I04", "type": "ideation", "label": "GEOS-RAG plugin (3-DB ChromaDB + geos-rag skill) as candidate adaptation surface", "status": "Assumed", "grounding": "literature", "parent": "I01", "date": "2026-04-20", "rationale": "Custom RAG ported from repo1/repo2 with 3 indices: documentation (RST), XML files, schema (input-schema + datastructure definitions). Per-task ChromaDB copy + MCP preflight. Whether this helps CC vs. CC's built-in file browsing is the open empirical question.", "evidence": []}
{"id": "E01", "type": "experiment", "label": "ablation_deepseek_v2: no-plugin CC + deepseek-v3.2 on 36 tasks", "status": "good", "grounding": "empirical", "parent": "I03", "date": "2026-04-20", "rationale": "Apples-to-apples no-plugin baseline using the v2 harness (primer-in-system-prompt, --disallowedTools Skill). 33/36 success, 3 timeout.", "evidence": ["ablation_findings.md"], "metric_name": "treesim", "metric_value": 0.643, "metric_std": null, "n_seeds": 1, "decision": "keep", "decision_reason": "Serves as the reference no-plugin condition for all plugin-vs-baseline contrasts on deepseek-v3.2."}
{"id": "E02", "type": "experiment", "label": "repo3_eval_run2: plugin CC + minimax-m2.7 on 36 tasks", "status": "good", "grounding": "empirical", "parent": "I04", "date": "2026-04-20", "rationale": "Earlier plugin run scored at 0.809 mean TreeSim, 78%% at >=7. Model differs from ablation baseline so this alone does NOT isolate plugin contribution.", "evidence": ["ablation_findings.md"], "metric_name": "treesim", "metric_value": 0.809, "metric_std": null, "n_seeds": 1, "decision": "keep", "decision_reason": "Useful as plugin-with-stronger-model reference point, but confounded vs E01."}
{"id": "I05", "type": "ideation", "label": "RQ: find CC adaptation that beats vanilla CC at model parity", "status": "exploring", "grounding": "literature", "parents": ["E01", "E02"], "date": "2026-04-20", "rationale": "Paper contribution rests on demonstrating some adaptation wins. First order of business for this session.", "evidence": []}
{"id": "E03", "type": "experiment", "label": "repo3_eval_run4: plugin CC + deepseek-v3.2 on 36 tasks", "status": "good", "grounding": "empirical", "parents": ["I05", "I04"], "date": "2026-04-20", "rationale": "Apples-to-apples vs E01: same 36 tasks, same deepseek-v3.2 model, same 20-min timeout. Scored 2026-04-20 against experiments_gt. 1/36 failed scoring (ExampleSPE11b parse error). Paired comparison on common 35 tasks shows plugin wins on 29/35, loses on 6, mean delta +0.175, pass >=0.7 rate 88.6% vs 54.3%.", "evidence": ["docs/XN-001_plugin-vs-no-plugin-deepseek.md"], "metric_name": "treesim", "metric_value": 0.828, "metric_std": null, "n_seeds": 1, "decision": "keep", "decision_reason": "Headline positive result for the paper: custom RAG plugin demonstrably improves CC on the easy GEOS-XML task at model parity. Resolves the main gap flagged in ablation_findings.md."}
{"id": "I06", "type": "ideation", "label": "Memory-system adaptation (Mem0 / Cheatsheet / BoT / GMemory; frozen pre-learned preferred)", "status": "exploring", "grounding": "literature", "parent": "I05", "date": "2026-04-20", "rationale": "User's strongest bet. Frozen pre-learned favored over continual because it preserves parallelism. Can be implemented external-to-CC (prompt-prepended cheatsheet) or as an MCP tool.", "evidence": []}
{"id": "I07", "type": "ideation", "label": "Primer design variations (structure, scope, in-prompt vs workspace file)", "status": "exploring", "grounding": "literature", "parent": "I05", "date": "2026-04-20", "rationale": "Ablation findings soft-suggest primer-in-system-prompt reduces timeouts. Instruction/structure variations untested. Bordering on vanilla-CC /init behavior so 'novelty' is thin — useful as a supporting result only.", "evidence": []}
{"id": "I08", "type": "ideation", "label": "File-tree context injection (pre-computed GEOS tree in system prompt)", "status": "negative", "grounding": "empirical", "parent": "I05", "date": "2026-04-20", "rationale": "Empirically CC wastes turns on ls/glob in inputFiles and docs. A static tree listing in the system prompt could cut those tool calls.", "evidence": ["docs/XN-007_filetree-negative.md"]}
{"id": "E07", "type": "experiment", "label": "tree_run1: plugin + precomputed inputFiles tree (~4500 tokens) on 17 test tasks", "status": "negative", "grounding": "empirical", "parents": ["I08"], "date": "2026-04-20", "rationale": "Injected a compact index of 746 XML files across 87 subdirs of /geos_lib/inputFiles into system prompt. Hypothesis: removes Glob/Bash-find exploration burn; gives agent direct file references. Result: 17/17 scored (3 timeouts produced partial XML that scored), 0 redacted_thinking failures. Mean TreeSim 0.604 vs plugin-only 0.831 paired, delta -0.227. Loses on 15/17 tasks. Largest losses on EXACTLY the tasks plugin-only rescues most (Sneddon -0.719; DPWellbore -0.687; Mandel -0.637). Filetree seems to distract agent from RAG-driven workflow.", "evidence": ["docs/XN-007_filetree-negative.md", "misc/e07_vs_e03_test17.txt"], "metric_name": "treesim", "metric_value": 0.604, "metric_std": null, "n_seeds": 1, "decision": "discard", "decision_reason": "System-prompt injection of any auxiliary content (cheatsheet OR filetree) hurts plugin. Plugin's value is specifically the RAG MCP + skill prompt; further system-prompt augmentation is counterproductive. Strong cross-experiment pattern."}
{"id": "E08", "type": "experiment", "label": "minprimer_run1: plugin + minimal primer (~450 tokens vs full ~10K) on 17 test tasks", "status": "negative", "grounding": "empirical", "parents": ["I07", "E03"], "date": "2026-04-20", "rationale": "Primer ablation: does primer content carry weight. Result: DECISIVELY YES. Minimal primer scored mean 0.596 vs full-primer plugin 0.831 paired delta -0.235. 16/17 tasks regress. 4 timeouts (vs 0 in E03). Largest losses on same 3 tasks as E07 (Sneddon -0.723, DPWellbore -0.688, Mandel -0.677). Primer content is load-bearing — the plugin's value is only fully realized with detailed primer context. Full primer + RAG MCP together form the active-ingredient stack.", "evidence": ["misc/e08_vs_e03_test17.txt"], "metric_name": "treesim", "metric_value": 0.596, "metric_std": null, "n_seeds": 1, "decision": "discard", "decision_reason": "Minimal primer is strictly worse. Full primer is load-bearing. Surprising finding: even with RAG present, the primer's detailed documentation map and schema-navigation context are needed for the rescue mechanism to fire on weak-model tasks."}
{"id": "E09", "type": "experiment", "label": "memws_run1: plugin + abstract cheatsheet in /workspace/CHEATSHEET.md (NOT system prompt) on 17 test tasks", "status": "negative", "grounding": "empirical", "parents": ["E04", "E05", "I10"], "date": "2026-04-20", "rationale": "Delivery-channel test: cheatsheet_abstract.md (550 tokens; shortcuts + pitfalls) copied to /workspace/CHEATSHEET.md; system prompt has only a 2-line pointer. Result: 11/17 agent success (vs 17/17 E03), 6 timeouts, 1 ParseError, 1 FileNotFoundError. Paired 15 scored: memws 0.622 vs plugin-only 0.831 delta -0.212. Wins 2/15, loses 13/15. Same rescue-task regressions as E07/E08 (Sneddon -0.733, DPWellbore -0.696, Mandel -0.618). Workspace-file delivery is NOT a safe channel for memory on this stack.", "evidence": ["misc/e09_vs_e03_test17.txt"], "metric_name": "treesim", "metric_value": 0.622, "metric_std": null, "n_seeds": 1, "decision": "discard", "decision_reason": "Channel distinction doesn't help. The failure is deeper than delivery — perturbing the tightly-coupled primer+plugin state consistently breaks the rescue mechanism on the same 3 tasks. Only remaining memory channel to test: MCP tool (E11)."}
{"id": "I09", "type": "ideation", "label": "Simpler flat-chunking RAG as alternative to the 3-DB custom design", "status": "exploring", "grounding": "literature", "parent": "I05", "date": "2026-04-20", "rationale": "User's own note: maybe the 3-DB design was overengineered; plain chunked doc RAG might be a fairer 'standard RAG' ablation point.", "evidence": []}
{"id": "I10", "type": "ideation", "label": "Memory-on-top-of-plugin: stack frozen pre-learned cheatsheet over existing plugin (demonstrates adaptation stacking)", "status": "exploring", "grounding": "literature", "parents": ["I06", "E03"], "date": "2026-04-20", "rationale": "E03 shows plugin already wins. Next research question: does adding memory yield compounding gains? Design: hold out N tasks as train set, CC+plugin writes lessons-learned cheatsheet, freeze cheatsheet, evaluate on remaining test tasks with cheatsheet prepended to system prompt. Preserves parallelism.", "evidence": ["decisions/D-001_memory-experiment-design.md"]}
{"id": "E04", "type": "experiment", "label": "mem_run1: plugin + cheatsheet CC + deepseek-v3.2 on 17 test tasks", "status": "negative", "grounding": "empirical", "parents": ["I10"], "date": "2026-04-20", "rationale": "First memory-stacking experiment. Cheatsheet (~1700 tokens, 6 themed sections) generated from 18 held-out train trajectories of repo3_eval_run4 via deepseek lesson-extraction + aggregation. Test set: 17 paired tasks. Result: MEMORY DECISIVELY HURT PERFORMANCE. 13/17 success (vs 17/17 in plugin baseline); 3 tasks failed with no XML output, 1 timed out. On 14 paired-scorable tasks, memory mean TreeSim 0.532 vs plugin 0.831 (delta -0.322). Memory wins on 1/14, loses on 13/14. Including 3 no-output tasks as 0, overall mean 0.438 (delta -0.393). Dominant failure mode: agent emits 'redacted_thinking' block then end_turn after 3-6 turns without calling Write/Edit. Hypothesis: cheatsheet bloat past ~23K system-prompt tokens triggers premature stop in deepseek-v3.2, and task-specific advice (e.g., 'use InternalWellbore') from train-task patterns mismatches test-task requirements.", "evidence": ["docs/XN-003_memory-experiment-negative.md"], "metric_name": "treesim", "metric_value": 0.532, "metric_std": null, "n_seeds": 1, "decision": "discard", "decision_reason": "Frozen-cheatsheet approach as specified in D-001 does not work on deepseek-v3.2. The hypothesis of 'adaptation stacking' is NOT supported by this design. Dead end for cheatsheet-in-system-prompt; revisit memory via (a) shorter cheatsheet restricted to cross-task patterns only, (b) memory as MCP tool rather than system-prompt inject, (c) stronger model that handles longer context."}
{"id": "I11", "type": "ideation", "label": "Plugin decomposition: geos-rag skill vs MCP RAG server attribution", "status": "exploring", "grounding": "literature", "parent": "E03", "date": "2026-04-20", "rationale": "Current plugin bundles (a) geos-rag skill prompt/instructions and (b) 3-DB ChromaDB MCP server. To attribute the E03 gain, need to run plugin-without-RAG-MCP (skill only) and RAG-MCP-without-skill. Defer to week-scope unless time.", "evidence": []}
{"id": "E11", "type": "experiment", "label": "gmem_run1: plugin + G-Memory-lite MCP tool (memory_lookup) on 17 test tasks", "status": "negative", "grounding": "empirical", "parents": ["E04", "E09", "I10"], "date": "2026-04-20", "rationale": "Frozen memory index of 18 train trajectories delivered as an MCP tool memory_lookup(query). Agent called the tool on 17/17 tasks (1 call each) — tool is discovered and used. Paired delta -0.192 vs plugin-only (0.638 vs 0.831 on 17). 13/17 success, 4 timeouts, wins 1/17 (pkn +0.142), loses 16/17. DIFFERENT from other negatives: memory RESCUES DPWellbore (0.939 vs plugin 0.992, only -0.05) and IMPROVES pkn. But still fails Sneddon -0.716, Mandel -0.669. Smallest negative delta in the memory battery (-0.192 vs -0.212 to -0.322 for E04/E05/E07/E08/E09).", "evidence": ["misc/e11_vs_e03_test17.txt"], "metric_name": "treesim", "metric_value": 0.638, "metric_std": null, "n_seeds": 1, "decision": "discard", "decision_reason": "MCP-tool channel is the least-bad memory variant but still net negative on the 17-task test subset. The rescue mechanism on Sneddon + Mandel appears fragile to any perturbation regardless of delivery channel. Memory-via-MCP is not strictly dead - it DOES rescue some tasks where other memory variants fail - but overall hurts."}
{"id": "E12", "type": "experiment", "label": "gmem_v2_run1: gated memory_lookup (threshold=0.6 + delay-trigger system-prompt) on 17 test tasks", "status": "negative", "grounding": "empirical", "parents": ["E11"], "date": "2026-04-21", "rationale": "Tested XN-009's diagnosis. Result: paired delta -0.186 (vs E11 -0.192) on 16 scored tasks (Sneddon failed_no_outputs - new failure mode where agent asked user a question via AskUserQuestion). Marginal improvement over E11. 4 wins (pkn +0.221 best), 12 losses; rescue tasks Mandel/DPWellbore/DeviatedElastic still catastrophic. Threshold correctly suppressed memory on Sneddon and Mandel, but agent still failed - suggests the memory INSTRUCTION (375 tokens) itself anchors behavior, even when memory is not called.", "evidence": ["misc/e12_vs_e03_test17.txt", "misc/gmem_v2_run1.log"], "metric_name": "treesim", "metric_value": 0.646, "metric_std": null, "n_seeds": 1, "decision": "discard", "decision_reason": "Threshold + delay alone insufficient. Hypothesis: the system-prompt instruction about memory (even cautionary) anchors agent reasoning. E13 tests this by stripping the instruction entirely (memory tool still available via MCP)."}
{"id": "E13", "type": "experiment", "label": "gmemsilent_run1: memory MCP tool available with NO system-prompt instruction on 17 test tasks", "status": "negative", "grounding": "empirical", "parents": ["E12"], "date": "2026-04-21", "rationale": "Memory tool present, agent never called it (mem=0 on all 17). Paired delta -0.180 vs E03 (0.651 vs 0.831). 5 timeouts. Result essentially identical to E11/E12, suggesting either tool-list presence affects behavior or this is seed variance. E14 (plain plugin re-run) confirmed it's the latter.", "evidence": ["misc/e13_vs_e03_test17.txt"], "metric_name": "treesim", "metric_value": 0.651, "metric_std": null, "n_seeds": 1, "decision": "discard", "decision_reason": "Same magnitude regression as E11/E12. Motivated E14 plugin-only seed-2 variance check, which showed plain plugin also drops to 0.616 — variance, not memory."}
{"id": "E14", "type": "experiment", "label": "plugin_seed2: PLAIN plugin-only on 17 test (variance check, fresh seed)", "status": "good", "grounding": "empirical", "parents": ["E03"], "date": "2026-04-21", "rationale": "Same plugin, same model, same tasks as E03 (collaborator's run from 2026-04-19). Result: paired delta -0.215 vs E03 (0.616 vs 0.831). Catastrophic regressions on the same 3 rescue tasks (Sneddon -0.735, DPWellbore -0.701, Mandel -0.610). MAJOR FINDING: cross-seed variance is huge (~0.2 mean delta), driven by the rescue tasks. The 'memory hurts -0.18 to -0.32' findings (E04-E13) are largely or entirely variance against the lucky E03 baseline. Memory variants score 0.62-0.65; plain plugin re-run scores 0.62.", "evidence": ["misc/e14_vs_e03_test17.txt"], "metric_name": "treesim", "metric_value": 0.616, "metric_std": null, "n_seeds": 1, "decision": "keep", "decision_reason": "Reframes all memory experiments. The plugin's headline +0.178 over no-plugin needs multi-seed verification. Memory variants are likely within noise of plugin baseline."}
{"id": "E15", "type": "experiment", "label": "noplug_seed2: PLAIN no-plugin on 17 test (no-plugin variance anchor)", "status": "good", "grounding": "empirical", "parents": ["E01"], "date": "2026-04-21", "rationale": "No-plugin cross-seed variance check on v1 specs. E15 mean 0.597 vs E01 mean 0.589 on 17 test - delta +0.008, within noise. No-plugin is highly stable across seeds (var <0.02). Confirms plugin-side cross-seed variance is asymmetric - plugin's rescue mechanism is variance-prone; no-plugin's consistent failure is low-variance.", "evidence": ["misc/e15_vs_e01_test17.txt"], "metric_name": "treesim", "metric_value": 0.597, "metric_std": null, "n_seeds": 1, "decision": "keep", "decision_reason": "Establishes that the plugin gain claim cannot be seed-variance-only; no-plugin's stability means any paired-same-seed plugin gain is real."}
{"id": "E16", "type": "experiment", "label": "noplug_mm_v2: no-plugin + minimax + v2 specs on 17 test (canonical baseline)", "status": "good", "grounding": "empirical", "parents": ["E02"], "date": "2026-04-21", "rationale": "Canonical baseline we never had. v2 specs = Brian's experiments_test36_template (the spec set that E03 was run on). 16/17 agent success, 12 scored (5 scoring errors from ParseError/RecursionError on no-plug-generated XML, not agent failures). Mean 0.566. With v2 specs + minimax this is the proper no-plugin reference.", "evidence": ["misc/e16_vs_e02_test17.txt"], "metric_name": "treesim", "metric_value": 0.566, "metric_std": null, "n_seeds": 1, "decision": "keep", "decision_reason": "Establishes the canonical no-plugin baseline on matched (v2) specs with the faster model we've chosen for future work."}
{"id": "E17", "type": "experiment", "label": "plug_mm_v2_seed2: plain plugin + minimax + v2 specs seed 2 on 17 test", "status": "good", "grounding": "empirical", "parents": ["E02", "E16"], "date": "2026-04-21", "rationale": "Plugin reproducibility + paired canonical baseline. 13/17 scored (4 failed_no_outputs unexpectedly - new failure mode on minimax). Mean 0.575, much lower than E02's 0.809 on 36 tasks. Cross-seed variance on plugin+minimax+v2 is ~0.23 similar to deepseek. Paired vs E16 (same seed): delta +0.055 - real but small plugin-only gain.", "evidence": ["misc/e17_vs_e16_test17.txt"], "metric_name": "treesim", "metric_value": 0.575, "metric_std": null, "n_seeds": 1, "decision": "keep", "decision_reason": "Matched-seed baseline for memory comparison. Shows plugin's cross-seed variance exists on minimax too. Plain-plugin canonical paired gain is only +0.055 vs no-plugin same seed."}
{"id": "E18", "type": "experiment", "label": "gmemsilent_mm_v2: gmem-silent MCP + minimax + v2 specs on 17 test (MEMORY WINS)", "status": "good", "grounding": "empirical", "parents": ["E13", "E17"], "date": "2026-04-21", "rationale": "First clean evidence memory helps. 17/17 success (vs E17's 13/17). Mean 0.725, median 0.847. Paired vs E16 (no-plug): delta +0.117. Paired vs E17 (plain plugin same seed): delta +0.094 - memory BEATS plain plugin. Wins 9/13 paired tasks. Biggest wins: IsothermalLeakyWell +0.511, CasedContactThermo +0.507, ModifiedCamClay +0.424, ThermoporoelasticConsolidation +0.298. Memory also prevents the plain-plugin failure modes (E17 had 4 failed_no_outputs; E18 had 0).", "evidence": ["misc/e18_vs_e16_test17.txt", "misc/e18_vs_e17_test17.txt"], "metric_name": "treesim", "metric_value": 0.725, "metric_std": null, "n_seeds": 1, "decision": "keep", "decision_reason": "First clean positive memory result. Memory+plugin > plain plugin > no-plugin on canonical specs. Reframes all prior 'memory hurts' findings as spec-mismatch + variance artifacts. Motivates: re-test other memory variants on v2 specs + minimax, and multi-seed."}
{"id": "E05", "type": "experiment", "label": "memshort_run1: plugin + short cross-task-only cheatsheet (~300 tokens) + explicit stop criterion on 17 test tasks", "status": "negative", "grounding": "empirical", "parents": ["E04", "I10"], "date": "2026-04-20", "rationale": "Isolates content-specificity (hypothesis 2) from context-bloat (hypothesis 1) for the E04 failure. New short cheatsheet: ~300 tokens, RAG usage + XML structure + common mistakes + explicit stop criterion. Result: 13/17 success (vs 17/17 plugin-only, matching E04's 13/17); mean TreeSim 0.561 on 14 scored vs 0.831 plugin-only on 17 (E03 test subset) - still catastrophically worse. Failure pattern identical to E04: same redacted_thinking -> end_turn signature on ModifiedCamClay (trapped in failed_no_outputs) and ExtendedDruckerPrager (new failure); and 2 timeouts (EDPWellbore, Mandel - both succeeded in both plugin-only and E04 long-cheatsheet conditions). Conclusion: length is NOT the dominant cause of cheatsheet failure. Any cheatsheet-in-system-prompt triggers the failure mode on a subset of tasks.", "evidence": ["docs/XN-003_memory-experiment-negative.md", "docs/XN-004_failure-mode-analysis-and-memory-plan.md"], "metric_name": "treesim", "metric_value": 0.561, "metric_std": null, "n_seeds": 1, "decision": "discard", "decision_reason": "Confirms hypothesis 1 (context bloat alone) is insufficient to explain the E04 failure. Both long (1700t) and short (300t) cheatsheets show same failure pattern. Defers memory via system-prompt-inject design entirely; future memory should be MCP-tool-on-demand or on a different model."}
