{"id": "E06", "type": "experiment", "label": "mm_noplug_run1: minimax-m2.7 no-plugin on 17 test tasks (cross-model paired vs E02)", "status": "good", "grounding": "empirical", "parents": ["E02", "E03"], "date": "2026-04-20", "rationale": "Cross-model robustness confirmed. 17/17 agent success in 17 min wall (workers=12, no rate-limit issues). Scored 15/17 (2 minimax tasks wrote malformed XML - ParseErrors on ExampleThermalLeakyWell and TutorialPoroelasticity). Paired on 15 tasks vs E02 (plugin+minimax): minimax no-plugin 0.694 vs minimax+plugin 0.809, delta -0.115 paired. Plugin wins 11/15, loses 4. Cross-model generalization of plugin advantage CONFIRMED on minimax-m2.7, though delta (-0.115) smaller than on deepseek-v3.2 (-0.175). Suggests plugin helps more on weaker base models.", "evidence": ["misc/e06_vs_e02.txt"], "metric_name": "treesim", "metric_value": 0.694, "metric_std": null, "n_seeds": 1, "decision": "keep", "decision_reason": "Positive cross-model result. Strengthens paper claim: plugin advantage is not a deepseek artifact. Concurrency=12 workers confirmed safe for OpenRouter rate limits."}
{"id": "I12", "type": "ideation", "label": "Stop-hook XML-verification rescue for minimax empty-completion failure", "status": "exploring", "grounding": "empirical", "parents": ["E17", "E18"], "date": "2026-04-21", "rationale": "Prior session diagnosed failed_no_outputs on minimax/OpenRouter as provider-side empty completion after tool_result (XN-010); proposed plugin Stop hook to block end_turn when /workspace/inputs/ is missing XML. This session discovered the hook never loaded (schema bug + missing --plugin-dir); now fixed. Pre-campaign gate for E20 ablation.", "evidence": ["docs/XN-010_early-end-turn-mechanism.md", "plugin/hooks/verify_outputs.py"]}
{"id": "I13", "type": "ideation", "label": "Tool-list-shape confound for E18-vs-E17 rescue pattern", "status": "exploring", "grounding": "empirical", "parents": ["E17", "E18"], "date": "2026-04-21", "rationale": "E18 (plug+gmem-silent) had 0 failed_no_outputs on the same 4 tasks that failed 4x in E17 (plug alone). Candidate mechanisms: (a) hook rescue [E18 had no hook], (b) any extra tool in list changes provider behavior, (c) memory tool docstring content, (d) single-run variance. Motivates C2 cell of E20.", "evidence": ["docs/SESSION_MAP_2026-04-21.md"]}
{"id": "E19", "type": "experiment", "label": "plughook_mm_v2: plain plugin + Stop hook (planned, never ran due to silent hook-load failure)", "status": "superseded", "grounding": "empirical", "parents": ["E17", "I12"], "date": "2026-04-21", "rationale": "Documented in misc/RUN_COMMANDS.md by prior session but never launched. Would have been a hook-off run indistinguishable from E17 because hooks.json schema was wrong and --plugin-dir was not passed to claude CLI. Superseded by E20.", "evidence": ["misc/RUN_COMMANDS.md"], "decision": "discard", "decision_reason": "Infrastructure never worked; subsumed by E20 narrow ablation with --settings-based hook routing."}
{"id": "E20", "type": "experiment", "label": "E20 narrow hook-ablation: 4 E17-failure tasks × 3 independent runs × 4 cells (C0/C1/C2/C4)", "status": "exploring", "grounding": "empirical", "parents": ["I12", "I13", "E17", "E18"], "date": "2026-04-21", "rationale": "Pre-registered design D-004. C0 (no hook) = E17 replicate; C1 (hook on) = rescue candidate; C2 (noop MCP, no hook) = tool-list confound; C4 (hook + noop) = interaction. Primary metric: failures-as-zero TreeSim, Wilcoxon paired. Smoketest verified plumbing 2026-04-21 11:40 (C2 mcp includes noop+connected; hook-events log fires).", "evidence": ["decisions/D-004_hook-ablation-e20.md"]}
{"id": "E20-COMPLETE", "type": "experiment", "label": "E20 hook-ablation results (see XN-012)", "status": "negative", "grounding": "empirical", "parents": ["E20"], "date": "2026-04-21", "rationale": "48 runs (4 tasks × 3 independent runs × 4 cells). E17's 4/17 failure rate did not reproduce — 0 failed_no_outputs in any cell. Paired Wilcoxon: hook effect Δ -0.112 fa0 TreeSim vs nohook (p≈0.31, n=12, underpowered). Runner retry salvaged 2 first-attempt failures that did fire. Hook validated as plumbing (fires, blocks, allows; event log works) but not as rescue mechanism. Decision per D-004 branch 4: do not expand.", "evidence": ["docs/XN-012_hook-ablation.md", "misc/e20_summary.json", "data/eval/results/e20/"], "metric_name": "treesim_fa0", "metric_value": 0.530, "metric_std": null, "n_seeds": 3, "decision": "discard", "decision_reason": "Hook claim not supported. Ship hook as safety net, not as paper contribution. Reallocate time budget to fallback paths (multi-seed E18 replication; curl reproducer for true empty completions)."}
{"id": "E23", "type": "experiment", "label": "pac1_plug_hook_s1: plug + SR (Stop hook) + minimax + v2, 17 test tasks, seed 1", "status": "planned", "grounding": "empirical", "parents": ["E17", "E20-COMPLETE"], "date": "2026-04-21", "rationale": "PAC-1 Phase A cell A3 (D-005). Full 17-task comparison complementing E20's narrow 4-task hook ablation. Pairs with E17 (plug-nohook) to attribute hook contribution over the full evaluation set. Uses claude_code_repo3_plugin default (hook ON via --settings).", "evidence": ["decisions/D-005_pac1-ablation-campaign.md", "docs/XN-013_pac1-phase-a-ablation.md"]}
{"id": "E24", "type": "experiment", "label": "pac1_plug_mem_hook_s1: FULL STACK (RAG+Memory+SR) + minimax + v2, 17 test tasks, seed 1", "status": "planned", "grounding": "empirical", "parents": ["E18", "E23", "E20-COMPLETE"], "date": "2026-04-21", "rationale": "PAC-1 Phase A cell A5 (D-005) — headline full-stack condition. E18 ran before verify_outputs.py existed (hook files 12:08 UTC vs E18 completed 06:37 UTC) so E18 is effectively A4 not A5. E24 is the genuine full-stack run. Uses claude_code_repo3_plugin_gmemsilent with hook ON.", "evidence": ["decisions/D-005_pac1-ablation-campaign.md", "docs/XN-013_pac1-phase-a-ablation.md"]}
{"id": "E23-RESULT", "type": "experiment", "label": "E23 pac1_plug_hook_s1 results: fa0 TreeSim 0.664 on 17 test tasks", "status": "good", "grounding": "empirical", "parents": ["E23"], "date": "2026-04-21", "rationale": "PAC-1 A3 complete. 17/17 success. fa0 TreeSim 0.664. Hook fired 23 times: 16 xml_clean:allow, 4 no_xml block/rescue, 2 parse_error rescue, 1 parse_error_max_retries. 4 tasks genuinely rescued by hook (no_xml tasks: IsothermalLeakyWell 0.964, ThermalLeakyWell 0.381, Poroelasticity 0.448, Sneddon 0.128).", "evidence": ["misc/pac1/scores/e23_summary.json", "misc/pac1/phase_a_summary.md"], "metric_name": "treesim_fa0", "metric_value": 0.664, "metric_std": null, "n_seeds": 1, "decision": "keep", "decision_reason": "Single-seed positive delta vs baseline (+0.167) and vs E17 plug-alone (+0.225, diff seed). Confirm with seed 2."}
{"id": "E24-RESULT", "type": "experiment", "label": "E24 pac1_plug_mem_hook_s1 (FULL STACK) results: fa0 TreeSim 0.317 - STACK LOSES vs baseline", "status": "negative", "grounding": "empirical", "parents": ["E24"], "date": "2026-04-21", "rationale": "PAC-1 A5 complete. 17/17 success. fa0 TreeSim 0.317 - WORSE THAN BASELINE (-0.180 paired vs E16). Hook fired 28 times incl 9 no_xml blocks, 3 parse_error. Memory_lookup tool_use count: 0/17 (same as E18). Adding the memory tool to the tool list (uncalled) AND the hook produces catastrophic regression vs either alone. A5-A3 paired delta -0.347 on 17 tasks (3/13 W/L). The effect is NOT memory-content poisoning; it is a tool-list-shape interaction with the hook.", "evidence": ["misc/pac1/scores/e24_summary.json", "misc/pac1/phase_a_summary.md"], "metric_name": "treesim_fa0", "metric_value": 0.317, "metric_std": null, "n_seeds": 1, "decision": "investigate", "decision_reason": "SURPRISE: full stack LOSES to baseline on single seed. Before any paper claim, need (a) seed 2 of A5 to rule out outlier, (b) A4' on current infra (no AQ) to isolate the hook's contribution from the AQ-removal confound. Multi-seed launched 2026-04-21T20:22 via /tmp/pac1_phase_a_seed2.sh."}
{"id": "D-006", "type": "decision", "label": "PAC-1 Phase A findings: adversarial review skipped — codex CLI unavailable", "status": "logged", "grounding": "infrastructure", "parents": ["E23-RESULT", "E24-RESULT", "D-003"], "date": "2026-04-21", "rationale": "codex CLI not installed on this workstation (same blocker as D-003 earlier today). Applied same-model self-critique as mitigation per skill attack-priority list. PAC-1 Phase A findings are explicitly single-seed and flagged preliminary; no paper claim yet. Multi-seed launched. Install codex before next paper-claim gate.", "evidence": ["decisions/D-006_pac1-adversarial-review-unavailable.md"]}
{"id": "E23s2", "type": "experiment", "label": "PAC-1 A3 seed 2: plug+SR (pac1_plug_hook_s2)", "status": "good", "grounding": "empirical", "parents": ["E23-RESULT"], "date": "2026-04-21", "rationale": "Multi-seed replication of A3. fa0 0.641 (seed 1 was 0.664). A3 cross-seed std ~0.017 — very stable. Confirms plug+SR is a reliable configuration.", "evidence": ["misc/pac1/scores/e23s2_summary.json"], "metric_name": "treesim_fa0", "metric_value": 0.641, "metric_std": null, "n_seeds": 1, "decision": "keep", "decision_reason": "A3 mean over 2 seeds = 0.653 vs baseline 0.497 = +0.155. Most stable positive cell."}
{"id": "E24s2", "type": "experiment", "label": "PAC-1 A5 seed 2: full stack (pac1_plug_mem_hook_s2)", "status": "good", "grounding": "empirical", "parents": ["E24-RESULT"], "date": "2026-04-21", "rationale": "Multi-seed replication of A5. fa0 0.729 (seed 1 was 0.317). Reverses the seed-1 negative reading — seed 1 was an outlier. Confirms full stack is viable but highly seed-variable.", "evidence": ["misc/pac1/scores/e24s2_summary.json"], "metric_name": "treesim_fa0", "metric_value": 0.729, "metric_std": null, "n_seeds": 1, "decision": "keep", "decision_reason": "A5 now shows bimodal distribution across seeds (0.317, 0.729 — std 0.29). Next seed continues characterization."}
{"id": "E24s3", "type": "experiment", "label": "PAC-1 A5 seed 3: full stack (pac1_plug_mem_hook_s3)", "status": "good", "grounding": "empirical", "parents": ["E24s2"], "date": "2026-04-21", "rationale": "A5 third seed. fa0 0.776. Seeds 2 and 3 cluster at ~0.75; seed 1 (0.317) was outlier. A5 mean over 3 seeds = 0.607; std 0.252.", "evidence": ["misc/pac1/scores/e24s3_summary.json"], "metric_name": "treesim_fa0", "metric_value": 0.776, "metric_std": null, "n_seeds": 1, "decision": "keep", "decision_reason": "Full stack mean +0.110 over baseline, not yet statistically significant. A5 volatile vs A3 stable."}
{"id": "E25", "type": "experiment", "label": "PAC-1 A4' seed 1: plug+Mem+nohook on current infra (pac1_plug_mem_nohook_s1)", "status": "good", "grounding": "empirical", "parents": ["E18", "E24-RESULT"], "date": "2026-04-21", "rationale": "Disambiguates A5-A4 confound. A4 (E18) ran with AskUserQuestion in tool list; current infra removed AQ. E25 = plug+mem-silent+no-hook on current infra. fa0 0.791. Confirms silent memory effect in absence of hook AND absence of AQ.", "evidence": ["misc/pac1/scores/a4prime_s1_summary.json"], "metric_name": "treesim_fa0", "metric_value": 0.791, "metric_std": null, "n_seeds": 1, "decision": "keep", "decision_reason": "A4' seed 1 is highest single-seed fa0 in campaign. 2 seeds average 0.661 mean."}
{"id": "E26", "type": "experiment", "label": "PAC-1 A4' seed 2: plug+Mem+nohook (pac1_plug_mem_nohook_s2)", "status": "good", "grounding": "empirical", "parents": ["E25"], "date": "2026-04-21", "rationale": "Second seed of A4'. fa0 0.531 (2 parse errors dropped to 0). A4' n=2 mean 0.661 vs baseline 0.497 = +0.164; std 0.184 (high variance). Without hook, parse errors become 0s; hook's SR rescue is needed for variance reduction.", "evidence": ["misc/pac1/scores/a4prime_s2_summary.json"], "metric_name": "treesim_fa0", "metric_value": 0.531, "metric_std": null, "n_seeds": 1, "decision": "keep", "decision_reason": "A4' confirms memory helps but is volatile without SR. Motivates keeping SR in the stack for reliability even if marginal TreeSim gain is zero."}
{"id": "E27", "type": "experiment", "label": "A3 seed 3: plug+SR (pac1_plug_hook_s3)", "status": "good", "grounding": "empirical", "parents": ["E23s2"], "date": "2026-04-22", "rationale": "Third A3 seed for proper baseline variance. fa0 0.267 — major outlier vs s1 (0.664) and s2 (0.641). A3 n=3 mean now 0.524, std 0.221 — much higher than n=2 σ=0.017 indicated. Confirms n=2 variance estimates unreliable (RN-003 P1 #4).", "evidence": ["misc/pac1/scores/a3_s3_summary.json"], "metric_name": "treesim_fa0", "metric_value": 0.267, "metric_std": null, "n_seeds": 1, "decision": "keep", "decision_reason": "Memory ablation analysis must now use paired-per-task Wilcoxon, not mean+std."}
{"id": "D-007-SUPERSEDED", "type": "decision", "label": "D-007 memory ablation design (superseded by D-008)", "status": "vetoed", "grounding": "methodological", "parents": ["XN-014", "LN-002"], "date": "2026-04-22", "rationale": "Original design vetoed by RN-003: 4 P1 blockers including test-task GT filename leakage in memory_index.json (14/17 tasks affected).", "evidence": [".copilot/decisions/D-007_memory-ablation-design.md", ".copilot/reviews/RN-003_adversarial_memory-ablation-design.md"], "decision": "discard", "decision_reason": "Superseded by D-008."}
{"id": "D-008", "type": "decision", "label": "Memory ablation V2: hygiene-fixed, placebo-controlled, cross-model distilled", "status": "exploring", "grounding": "methodological", "parents": ["D-007-SUPERSEDED", "RN-003"], "date": "2026-04-22", "rationale": "Post-RN-003 fixes: hygiene audit gate, M-placebo control, token parity preregistered, gemini-3-flash-preview distillation, paired-per-task Wilcoxon. 6 new conditions × 3 seeds.", "evidence": [".copilot/decisions/D-008_memory-ablation-design-v2.md"], "decision": "keep", "decision_reason": "Active sprint — matrix launched 2026-04-22T04:29:36Z."}
